{
  "$schema": "https://json-schema.org/draft/2020-12/schema",
  "type": "object",
  "additionalProperties": false,
  "required": [
    "displayName",
    "shortDescription",
    "longDescription",
    "developerName",
    "category",
    "capabilities",
    "websiteURL",
    "defaultPrompt",
    "hooks"
  ],
  "properties": {
    "displayName": {
      "type": "string",
      "minLength": 1
    },
    "shortDescription": {
      "type": "string",
      "minLength": 1
    },
    "longDescription": {
      "type": "string",
      "minLength": 1
    },
    "developerName": {
      "type": "string",
      "minLength": 1
    },
    "category": {
      "const": "Developer Tools"
    },
    "capabilities": {
      "const": [
        "design-apple-foundation-models-handoff",
        "implement-apple-foundation-models-handoff",
        "review-apple-foundation-models-handoff",
        "debug-apple-foundation-models-handoff",
        "validate-apple-foundation-models-handoff",
        "route-apple-foundation-models-handoff"
      ]
    },
    "websiteURL": {
      "type": "string",
      "pattern": "^https://"
    },
    "defaultPrompt": {
      "type": "array",
      "minItems": 1,
      "maxItems": 3,
      "items": {
        "type": "string",
        "minLength": 1,
        "maxLength": 128
      }
    },
    "hooks": {
      "const": "./hooks/codex/hooks.json"
    }
  }
}
