{
  "displayName": "Apple Foundation Models Handoff",
  "shortDescription": "Five workflows plus one non-positive router.",
  "longDescription": "Five workflows plus one non-positive router for Apple Foundation Models handoff requests, with explicit Apple API availability, state, trust, recovery, and evidence boundaries.",
  "developerName": "Joseph Knickerbocker",
  "category": "Developer Tools",
  "capabilities": [
    "design-apple-foundation-models-handoff",
    "implement-apple-foundation-models-handoff",
    "review-apple-foundation-models-handoff",
    "debug-apple-foundation-models-handoff",
    "validate-apple-foundation-models-handoff",
    "route-apple-foundation-models-handoff"
  ],
  "websiteURL": "https://github.com/jbknick/agent-apple-foundation-handoff",
  "defaultPrompt": [
    "Design an Apple Foundation Models baton pass from a research profile to a review profile that owns the final answer."
  ],
  "hooks": "./hooks/codex/hooks.json"
}
